{
  "pair_id": "MANUAL-JAVA-RENAME-001",
  "problem_id": "P-MANUAL-ARRAY-001",
  "problem_type": "array_loop",
  "problem_group": "G2",
  "dataset_split": "validation",
  "split_preregistered": true,
  "source_id": "SRC-MANUAL-ARRAY-001",
  "experiment_label": "TRANSFORMED",
  "case_type": "VARIABLE_RENAME",
  "language": "java",
  "language_a": "java",
  "language_b": "java",
  "dataset_version": "coderisk-research-v4-seed-1.0",
  "data_origin": "MANUAL",
  "source_type": "manual",
  "synthetic": false,
  "eligible_for_core_metrics": false,
  "question": {
    "title": "Array loop manual sample",
    "description": "Traceable manual pair for variable rename testing.",
    "input_format": "Describe input format.",
    "output_format": "Describe output format.",
    "constraints_text": "Describe constraints."
  },
  "code_a_path": "samples/manual/P-MANUAL-ARRAY-001/A.java",
  "code_b_path": "samples/manual/P-MANUAL-ARRAY-001/B.java",
  "provenance": {
    "source": "manual collection by project author",
    "license_or_authorization": "author-created sample for CodeRisk Research V4",
    "manual_check_status": "PENDING",
    "functional_check_status": "NOT_RUN"
  },
  "notes": "Template only. Prefer add_research_v4_case.py so SHA-256 is computed automatically."
}
